### ISSUE TITLE
Ubuntu下，多网卡环境，报错接口超时

### ISSUE THREAD

**Issue by 188080501** [jeessy2/ddns-go#1658]
### Description

Ubuntu下使用，Http Interface选择default，或者主网络（我的场景下ens33），是正常的，可以正常更新dns解析。但是选择子网络（我的场景下是ens37），就报错，无法正常更新dns解析

ddns-go这里报错
2026/04/02 11:21:57 Failed to query domain info! Get "https://alidns.aliyuncs.com/?AccessKeyId=xxxxx&Action=DescribeSubDomainRecords&DomainName=xxxxx.com&Format=JSON&Signature=xxxxx%3D&SignatureMethod=HMAC-SHA1&SignatureNonce=1775100087543400595&SignatureVersion=1.0&SubDomain=xxxx.xxxx.com&Timestamp=2026-04-02T03%3A21%3A27Z&Type=A&Version=2015-01-09": context deadline exceeded (Client.Timeout exceeded while awaiting headers)
敏感信息已经被替换，key和域名的配置都是正确的。

2个网络都是电信的网络，都是可以正常上网的，未做限制

我的环境如下：
➜  ~ ip route
default via 10.0.1.1 dev ens33 proto static metric 100
default via 192.168.1.1 dev ens37 proto dhcp src 192.168.1.53 metric 101
10.0.1.0/24 dev ens33 proto kernel scope link src 10.0.1.225 metric 100
192.168.1.0/24 dev ens37 proto kernel scope link src 192.168.1.53 metric 101

使用curl可以正常指定网卡，并且获取到正确的公网ip
➜  ~ curl --interface ens37 --connect-timeout 5 --max-time 15 https://ifconfig.me/
125.119.203.xx
➜  ~ curl --interface ens33 --connect-timeout 5 --max-time 15 https://ifconfig.me/
23.249.17.xx

tcpdump，在ddns-go保存配置文件后，ens33可以抓到一些数据，但是指定ens37抓不到数据
疑似设置了ens37后，任然从ens33出站
➜  ~ sudo tcpdump host alidns.aliyuncs.com
tcpdump: verbose output suppressed, use -v[v]... for full protocol decode
listening on ens33, link-type EN10MB (Ethernet), snapshot length 262144 bytes
11:33:35.917265 IP 192.168.1.53.48515 > 47.111.202.72.https: Flags [S], seq 2341631315, win 64240, options [mss 1460,sackOK,TS val 2362466944 ecr 0,nop,wscale 9], length 0
11:33:36.959155 IP 192.168.1.53.48515 > 47.111.202.72.https: Flags [S], seq 2341631315, win 64240, options [mss 1460,sackOK,TS val 2362467986 ecr 0,nop,wscale 9], length 0
11:33:37.982898 IP 192.168.1.53.48515 > 47.111.202.72.https: Flags [S], seq 2341631315, win 64240, options [mss 1460,sackOK,TS val 2362469010 ecr 0,nop,wscale 9], length 0
11:33:39.006917 IP 192.168.1.53.48515 > 47.111.202.72.https: Flags [S], seq 2341631315, win 64240, options [mss 1460,sackOK,TS val 2362470034 ecr 0,nop,wscale 9], length 0
11:33:40.031159 IP 192.168.1.53.48515 > 47.111.202.72.https: Flags [S], seq 2341631315, win 64240, options [mss 1460,sackOK,TS val 2362471058 ecr 0,nop,wscale 9], length 0
11:33:41.055402 IP 192.168.1.53.48515 > 47.111.202.72.https: Flags [S], seq 2341631315, win 64240, options [mss 1460,sackOK,TS val 2362472082 ecr 0,nop,wscale 9], length 0
11:33:43.103045 IP 192.168.1.53.48515 > 47.111.202.72.https: Flags [S], seq 2341631315, win 64240, options [mss 1460,sackOK,TS val 2362474130 ecr 0,nop,wscale 9], length 0

### DNS Provider

Aliyun

### Did you search for similar issues before submitting this one?

未找到类似Issuse

### Operating System

Linux

### Architecture

i386

### Version

v6.16.2

### How are you running ddns-go?

Service

**Comment by 188080501** [comment]
ddns-go没找到相关设置，这个问题要如何解决？需要手动从系统层面做设置吗？

**Comment by 188080501** [comment]
我创建了一个pr，已经测试了，在我的环境下正常运行，可以切换对应网卡并且正常更新ddns
https://github.com/jeessy2/ddns-go/pull/1661

**Comment by jeessy2** [comment]
这个问题已经处理了，相关修复见 #1661。

下个版本发布后直接升级即可；如果着急使用，也可以先自行编译当前最新代码验证。
